"page_url","page_name","has_tables","table_number","tables_markdown"
"https://wiki.nanofab.ucsb.edu/wiki/ADT_UV-Tape_Table_1042R","ADT_UV-Tape_Table_1042R","no","no_tables",""
"https://wiki.nanofab.ucsb.edu/wiki/LegacyTable","LegacyTable","yes","table_1","| e_beam_lithography_recipes | e_beam_lithography_recipes_1 | e_beam_lithography_recipes_2 | e_beam_lithography_recipes_3 | e_beam_lithography_recipes_4 | e_beam_lithography_recipes_5 | e_beam_lithography_recipes_6 | e_beam_lithography_recipes_7 | e_beam_lithography_recipes_8 | [LINEBREAK] |:-----------------------------|:-------------------------------|:-------------------------------|:-------------------------------|:-------------------------------|:-------------------------------|:-------------------------------|:----------------------------------|:--------------------------------------------| [LINEBREAK] | | Contact Aligners | Contact Aligners | Steppers | Steppers | Steppers | Flood Expose | E-Beam Lithography | E-Beam Lithography | [LINEBREAK] | Positive Resists | SUSS MJB-3 | SUSS MA-6 | Stepper 1 (GCA 6300) | Stepper 2 (AutoStep 200) | Stepper 3 (ASML DUV) | DUV Flood | Field Emission SEM 1 (FEI Sirion) | E-Beam Lithography System (JEOL JBX-6300FS) | [LINEBREAK] | AZ4110 | R1 | R1 | A | A | | | | | [LINEBREAK] | AZ4210 | R1 | R1 | A | A | | | | | [LINEBREAK] | AZ4330RS | R1 | R1 | A | A | | | | | [LINEBREAK] | OCG 825-35CS | A | A | A | A | | | | | [LINEBREAK] | SPR 950-0.8 | A | A | A | A | | | | | [LINEBREAK] | SPR 955 CM-0.9 | A | A | R1 | R1 | | | | | [LINEBREAK] | SPR 955 CM-1.8 | A | A | R1 | R1 | | | | | [LINEBREAK] | SPR 220-3.0 | R1 | R1 | R1 | R1 | | | | | [LINEBREAK] | SPR 220-7.0 | R1 | R1 | R1 | R1 | | | | | [LINEBREAK] | THMR-IP3600 HP D | | | A | A | | | | | [LINEBREAK] | UV6-0.7 | | | | | R1 | | | | [LINEBREAK] | UV210-0.3 | | | | | R1 | | | | [LINEBREAK] | Negative Resists | SUSS MJB-3 | SUSS MA-6 | Stepper 1 (GCA 6300) | Stepper 2 (AutoStep 200) | Stepper 3 (ASML DUV) | DUV Flood | Field Emission SEM 1 (FEI Sirion) | E-Beam Lithography System (JEOL JBX-6300FS) | [LINEBREAK] | AZ5214-EIR | R1 | R1 | R1 | R1 | | | | | [LINEBREAK] | AZnLOF 2020 | R1 | R1 | R1 | R1 | | | | | [LINEBREAK] | AZnLOF 2035 | A | A | A | A | | | | | [LINEBREAK] | AZnLOF 2070 | A | A | A | A | | | | | [LINEBREAK] | AZnLOF 5510 | A | A | R1 | R1 | | | | | [LINEBREAK] | UVN2300-0.5 | | | | | R1 | | | | [LINEBREAK] | SU-8 2015 | A | A | A | A | | | | | [LINEBREAK] | Underlayers | SUSS MJB-3 | SUSS MA-6 | Stepper 1 (GCA 6300) | Stepper 2 (AutoStep 200) | Stepper 3 (ASML DUV) | DUV Flood | Field Emission SEM 1 (FEI Sirion) | E-Beam Lithography System (JEOL JBX-6300FS) | [LINEBREAK] | PMGI SF-11 | | | | | | | | | [LINEBREAK] | PMGI SF-15 | | | | | | | | | [LINEBREAK] | LOL 2000 | | | | | | | | | [LINEBREAK] | XHRIC-11 (i-lineBARC) | | | | | | | | | [LINEBREAK] | AR-2 (DUV BARC) | | | | | | | | | [LINEBREAK] | DS-K101 (DUV BARC) | | | | | | | | | [LINEBREAK] | Overlayers | SUSS MJB-3 | SUSS MA-6 | Stepper 1 (GCA 6300) | Stepper 2 (AutoStep 200) | Stepper 3 (ASML DUV) | DUV Flood | Field Emission SEM 1 (FEI Sirion) | E-Beam Lithography System (JEOL JBX-6300FS) | [LINEBREAK] | CEM-365 IS | | | | | | | | | [LINEBREAK] | E-Beam Resists | SUSS MJB-3 | SUSS MA-6 | Stepper 1 (GCA 6300) | Stepper 2 (AutoStep 200) | Stepper 3 (ASML DUV) | DUV Flood | Field Emission SEM 1 (FEI Sirion) | E-Beam Lithography System (JEOL JBX-6300FS) | [LINEBREAK] | ?????? | | | | | | | | | [LINEBREAK] | ??????? | | | | | | | | | [LINEBREAK] | Nanoimprint Resists | SUSS MJB-3 | SUSS MA-6 | Stepper 1 (GCA 6300) | Stepper 2 (AutoStep 200) | Stepper 3 (ASML DUV) | DUV Flood | Field Emission SEM 1 (FEI Sirion) | E-Beam Lithography System (JEOL JBX-6300FS) | [LINEBREAK] | MR-I 7020 | | | | | | | | | [LINEBREAK] | Nanonex NX-1020 | | | | | | | | | [LINEBREAK] | | SUSS MJB-3 | SUSS MA-6 | Stepper 1 (GCA 6300) | Stepper 2 (AutoStep 200) | Stepper 3 (ASML DUV) | DUV Flood | Field Emission SEM 1 (FEI Sirion) | E-Beam Lithography System (JEOL JBX-6300FS) |"
"https://wiki.nanofab.ucsb.edu/wiki/Stepper_2_(Autostep_200)_-_Table_of_Chucks,_Shims,_Target_Thicknesses","Stepper_2__Autostep_200__-_Table_of_Chucks__Shims__Target_Thicknesses","yes","table_1","| substrate_chuck_substrate_size | substrate_chuck_chuck_name | substrate_chuck_substrate__thickness_s | loading_chuck_shim_pick_right_chuck | loading_chuck_shim_shim | stepper_chuck_size | wafer_diameter_wafer_size | target_thickness_chuck__thickness_c | target_thickness_c_s_12_150_______0_1_mm | comment | comment_1 | [LINEBREAK] |:---------------------------------|:-----------------------------------|:-----------------------------------------|:------------------------------------------------------------------------------------------------------------------------------------------------------------------|:------------------------------------------------------------------------------------------------------------------------------------------------------------------|:------------------------------------------------------------------------------------------------------------------------------------------------------------------|:------------------------------------------------------------------------------------------------------------------------------------------------------------------|:------------------------------------------------------------------------------------------------------------------------------------------------------------------|:------------------------------------------------------------------------------------------------------------------------------------------------------------------|:------------------------------------------------------------------------------------------------------------------------------------------------------------------|:------------------------------------------------------------------------------------------------------------------------------------------------------------------| [LINEBREAK] | 1/4 of 2"""" or less | SMALL 1/4 of 2"""" chuck-500um | 350um=0.350mm | 1/4 of 2""""/500um+shim | 130um | 142 | 50.8mm | 11.646mm | 11.646+0.350+0.130=12.126mm | OK | ≤350um; use shim 130-230um | [LINEBREAK] | | (Adam:1/4 2"""") | 400um=0.500mm | 1/4of2""""/500um+shim | 130um | 142 | 50.8mm | 11.646mm | 11.646+0.400+0.130=12.176mm | OK | (350-500)um; use shim 130-180um | [LINEBREAK] | | | 500um=0.500mm | 1/4of2""""/500um | no | 142 | 50.8mm | 11.646mm | 11.646+0.500=12.146mm | OK | | [LINEBREAK] | | | 604um=0.604mm | 1/4of2""""/500um | no | 142 | 50.8mm | 11.646mm | 11.646+0.604=12.25mm | OK | limit | [LINEBREAK] | | | | | | | | | | | | [LINEBREAK] | 1/4 of 2"""" or less | SMALL 1/4 of 2"""" chuck-635um | 350um=0.350mm | 1/4of2""""/635um+shim | 180um | 142 | 50.8mm | 11.536mm | 11.536+0.350+0.180=12.126mm | OK | ≤350um; use shim 180-260um | [LINEBREAK] | | (Adam:1/4 2"""") | 500um=0.500mm | 1/4of2""""/635um+shim | 130um | 142 | 50.8mm | 11.536mm | 11.536+0.500+0.130=12.166mm | OK | | [LINEBREAK] | | | 635um=0.635mm | 1/4of2""""/635um | no | 142 | 50.8mm | 11.536mm | 11.536+0.635=12.171mm | OK | | [LINEBREAK] | | | 714um=0.635mm | 1/4of2""""/635um | no | 142 | 50.8mm | 11.536mm | 11.536+0.714=12.250mm | OK | limit | [LINEBREAK] | | | | | | | | | | | | [LINEBREAK] | 2"""" and smaller | SMALL 2"""" CHUCK-500um | 350um=0.35mm | 2""""/500um+shim | 130um | 2 (for 2"""") | 50.8mm | 11.650mm | 11.650+0.350+0.130=12.130mm | OK | ≤350um; use shim 130-230um | [LINEBREAK] | | (Adam:2"""") | 500um=0.500mm | 2""""/500um | no | 2 (for 2"""") | 50.8mm | 11.650mm | 11.650+0.500=12.150mm | OK | | [LINEBREAK] | | | 600um=0.600mm | 2""""/500um | no | 2 (for 2"""") | 50.8mm | 11.650mm | 11.650+0.600=12.250mm | OK | limit | [LINEBREAK] | | | | | | | | | | | | [LINEBREAK] | 3"""" and smaller | 3"""" CHUCK-635um | 350um=0.350mm | 3""""/635um+shim | 130um | 3 (for 3"""") | 76.2mm | 11.570mm | 11.570+0.350+0.130=12.050mm | OK | ≤350um; use shim 130-260um | [LINEBREAK] | | (Adam: 76.2mm) | 500um=0.500mm | 3""""/635um | no | 3 (for 3"""") | 76.2mm | 11.570mm | 11.570+0.500=12.070mm | OK | | [LINEBREAK] | | | 680um=0.680mm | 3""""/635um | no | 3 (for 3"""") | 76.2mm | 11.570mm | 11.570+0.680=12.250mm | OK | limit | [LINEBREAK] | | | | | | | | | | | | [LINEBREAK] | 4"""" and smaller | STANDARD CHUCK-500um | 350um=0.350mm | 4""""/500um+shim | 130um | 100 (for 4"""") | 100mm | 11.630mm | 11.630+0.350+0.130=12.11mm | OK | ≤350um; use shim 130-260um | [LINEBREAK] | | (Adam: 100mm) | 500um=0.500mm | 4""""/500um | no | 100 (for 4"""") | 100mm | 11.630mm | 11.630+0.500=12.13mm | OK | | [LINEBREAK] | | | 620um=0.620mm | 4""""/500um | no | 100 (for 4"""") | 100mm | 11.630mm | 11.630+0.620=12.25mm | OK | limit | [LINEBREAK] | | | | | | | | | | | | [LINEBREAK] | 4"""" and smaller | BIG METAL CHUCK | 350um=0.350mm | Al 100mm | 130um | 100 (for 4"""") | 100mm | 11.570mm | 11.570+0.350+0.130=12.050mm | OK | ≤350um; use shim 130-260um | [LINEBREAK] | | ( Adam:Al 100mm) | 500um=0.500mm | Al 100mm | no | 100 (for 4"""") | 100mm | 11.570mm | 11.570+0.500=12.070mm | OK | | [LINEBREAK] | | | 635um=0.635mm | Al 100mm | no | 100 (for 4"""") | 100mm | 11.570mm | 11.570+0.635=12.205mm | OK | | [LINEBREAK] | | | 680um=0.680mm | Al 100mm | no | 100 (for 4"""") | 100mm | 11.570mm | 11.570+0.680=12.250mm | OK | limit | [LINEBREAK] | | | | | | | | | | | | [LINEBREAK] | 4"""" and smaller | BLACK MULTI -720um | 350um=0.350mm | Black multi+shim | 260um | 7100 | 100mm | 11.440mm | 11.440+0.350+0.260=12.05mm | OK | limit | [LINEBREAK] | | ( Adam:Black multi) | 500um=0.500mm | Black multi+shim | 130um | 7100 | 100mm | 11.440mm | 11.440+0.500+0.130=12.07mm | OK | use shim 130-230um | [LINEBREAK] | | | 550um=0.550mm | Black multi+shim | 260um | 7100 | 100mm | 11.440mm | 11.440+0.550+0.260=12.25mm | OK | limit | [LINEBREAK] | | | 720um=0.720mm | Black multi | no | 7100 | 100mm | 11.440mm | 11.440+0.720=12.16mm | OK | | [LINEBREAK] | | | | | | | | | | | | [LINEBREAK] | | | 810um=0.810mm | Black multi | no | 7100 | 100mm | 11.440mm | 11.440+0.810=12.25mm | OK | limit | [LINEBREAK] | | | | | | | | | | | | [LINEBREAK] | 4"""" and smaller | UNIVERSAL-1000um | 350um=0.350mm | Universal chuck+shim | 600um | 100 (for 4"""" or smaller) | 100mm | 11.200mm | 11.200+0.350+0.600=12.15mm | OK | use 600um shim | [LINEBREAK] | | | 500um=0.500mm | Universal chuck+shim | 450mm | 100 (for 4"""" or smaller) | 100mm | 11.200mm | 11.200+0.500+0.450=12.15mm | OK | use 450um shim | [LINEBREAK] | | | 635um=0.635mm | Universal chuck+shim | 260um | 100 (for 4"""" or smaller) | 100mm | 11.200mm | 11.200+0.635+0.260=12.095mm | OK | use 260um shim | [LINEBREAK] | | | 680um=0.680mm | Universal chuck+shim | 260um | 100 (for 4"""" or smaller) | 100mm | 11.200mm | 11.200+0.680+0.260=12.14mm | OK | use 260um shim | [LINEBREAK] | | | 1000um=1.000mm | Universal chuck+shim | no shim | 100 (for 4"""" or smaller) | 100mm | 11.200mm | 11.200+0.350+0.600=12.15mm | OK | | [LINEBREAK] | | | | | | | | | | | | [LINEBREAK] | 6"""" | We do have chuck | custom puddles | SHIMS: Shims can be cut from other material (cabinet next to stepper; first drawer. Shim Thickness: 0.01mm to 0.75mm (each color- represents different thickness) | SHIMS: Shims can be cut from other material (cabinet next to stepper; first drawer. Shim Thickness: 0.01mm to 0.75mm (each color- represents different thickness) | SHIMS: Shims can be cut from other material (cabinet next to stepper; first drawer. Shim Thickness: 0.01mm to 0.75mm (each color- represents different thickness) | SHIMS: Shims can be cut from other material (cabinet next to stepper; first drawer. Shim Thickness: 0.01mm to 0.75mm (each color- represents different thickness) | SHIMS: Shims can be cut from other material (cabinet next to stepper; first drawer. Shim Thickness: 0.01mm to 0.75mm (each color- represents different thickness) | SHIMS: Shims can be cut from other material (cabinet next to stepper; first drawer. Shim Thickness: 0.01mm to 0.75mm (each color- represents different thickness) | SHIMS: Shims can be cut from other material (cabinet next to stepper; first drawer. Shim Thickness: 0.01mm to 0.75mm (each color- represents different thickness) | SHIMS: Shims can be cut from other material (cabinet next to stepper; first drawer. Shim Thickness: 0.01mm to 0.75mm (each color- represents different thickness) | [LINEBREAK] | | Thinning down from 12.74 to 11.64! | 3C can make them | SHIMS: Shims can be cut from other material (cabinet next to stepper; first drawer. Shim Thickness: 0.01mm to 0.75mm (each color- represents different thickness) | SHIMS: Shims can be cut from other material (cabinet next to stepper; first drawer. Shim Thickness: 0.01mm to 0.75mm (each color- represents different thickness) | SHIMS: Shims can be cut from other material (cabinet next to stepper; first drawer. Shim Thickness: 0.01mm to 0.75mm (each color- represents different thickness) | SHIMS: Shims can be cut from other material (cabinet next to stepper; first drawer. Shim Thickness: 0.01mm to 0.75mm (each color- represents different thickness) | SHIMS: Shims can be cut from other material (cabinet next to stepper; first drawer. Shim Thickness: 0.01mm to 0.75mm (each color- represents different thickness) | SHIMS: Shims can be cut from other material (cabinet next to stepper; first drawer. Shim Thickness: 0.01mm to 0.75mm (each color- represents different thickness) | SHIMS: Shims can be cut from other material (cabinet next to stepper; first drawer. Shim Thickness: 0.01mm to 0.75mm (each color- represents different thickness) | SHIMS: Shims can be cut from other material (cabinet next to stepper; first drawer. Shim Thickness: 0.01mm to 0.75mm (each color- represents different thickness) |"
"https://wiki.nanofab.ucsb.edu/wiki/Ovens_-_Overview_of_All_Lab_Ovens","Ovens_-_Overview_of_All_Lab_Ovens","yes","table_1","| oven_name___link | temperature_range_capabilities | programmable | gases | vacuum_pressure_range | typical_uses | signupmonkey_reservation | [LINEBREAK] |:-----------------------|:--------------------------------------------------------------------------|:--------------------------------------------------------------------------------------------------------|:----------------------------------------|:------------------------|:----------------------------------|:--------------------------------------------| [LINEBREAK] | Oven 1 | Typically 95°C Passive Cooling | No; single temperature. | N/A | Atmosphere only | Drying glassware; general baking. | No. Users may change temperature. | [LINEBREAK] | Oven 2 | Typically 100°C Passive Cooling | No; single temperature. | N/A | Atmosphere only | Drying glassware; general baking. | No. Users may change temperature. | [LINEBREAK] | Oven 4: HeraTherm Oven | Max. Temp = 330°C Passive Cooling; optional vent to atmosphere for speed. | Multi-step programmable Ramp Rate: only low/med/high (not numeric ramp rate). Gas flow not programmable | N2 (manual flow valve) Atmosphere Purge | Atmosphere only | Bonding; BCB/Polymer curing. | Sign Up For This Tool (Also log in logbook) | [LINEBREAK] | Blue-M Oven | Max. temp. 350°C Passive Cooling | Yes; fully programmable up to 2 stages. Gas flow not programmable | N2 (manual flow setting) | Atmosphere only | BCB/Polymer curing. | Sign Up For This Tool | [LINEBREAK] | | | | | | | |"
"https://wiki.nanofab.ucsb.edu/wiki/Lift-Off_with_DUV_Imaging_%2B_PMGI_Underlayer","Lift-Off_with_DUV_Imaging__2B_PMGI_Underlayer","yes","table_1","| 0 | 1 | [LINEBREAK] |:-------------------------------------------------------------------------|:-----------------------------------------------------------------------------------------------------------------------------------------------------------------------------------------------------------------------------| [LINEBREAK] | De-H2O Bake (eg. 220°C; 1m+) - or - Technics O2 ash (300mT; 100W); 15sec | Oxygen ash is faster and more effective | [LINEBREAK] | Spin PMGI SF-5 @ 4krpm (rcp 7) | | [LINEBREAK] | POLOS underside clean: 2000rpm; ACE/ISO/N2 | | [LINEBREAK] | PMGI-Bake: 220°C; 3min (BrewerSci lift-pin hotplate). | Can just place wafer directly onto hotplate surface. Optionally can use lift-pins & Recipe """"00 220deg, 3min Vac""""; --> To prevent wafer sliding: Enable Vacuum with overhead valve, only for wafer landing and then turn off. | [LINEBREAK] | Spin UV-6-0.8 @ rcp 6 (3.5krpm) | | [LINEBREAK] | POLOS underside clean: 2000rpm; ACE/ISO/N2 | | [LINEBREAK] | Soft-Bake = 135°C; 1min (builtin hotplate) | | [LINEBREAK] | (check underside for particulates) | | [LINEBREAK] | ASML Exposure | | [LINEBREAK] | Default: Exp = 37.5mJ // foc = –0.10 | Try this exposure dose but might need to do a FocArray (smaller Image Distribution eg. 5x5) to find proper exposure. | [LINEBREAK] | PEB = 135°C; 1.5min (built-in hotplate) | | [LINEBREAK] | Dev (300MiF) = 50sec (CRITICAL time) | Use cassette & H2O rinse dish prepared --> not stirring, instead very slow/gentle lift/drop at various angles or gentle swish just to mix developer slightly. | [LINEBREAK] | DI rinse | Very Gently! Dunk into prepared DI dish; and dump/fill gently 2x. Don’t allow direct hard water to hit PR surface. | [LINEBREAK] | Dry - either low-pressure N2; or spin-dry | 4-inch wafers - use spin-dry on POLOS spinner. Small samples - use low-pressure (eg. 15psi) N2 gun. | [LINEBREAK] | PEii Technics O2: 30sec (100W/300mT) | May increase feature size openings by ~50nm. | [LINEBREAK] | Metal Evaporation (insert steps) | EBeam#4 or EBeam#1 with vertical/4-inch holders (not planetary) | [LINEBREAK] | Lift-off in NMP | Facing down or vertical. Optional: going directly into continuous Ultrasonic can reduce residual particles. |"
"https://wiki.nanofab.ucsb.edu/wiki/Lithography_Recipes","Lithography_Recipes","yes","table_1","| table_of_contents | [LINEBREAK] |:-----------------------------------------------------------------------------------------------------------------------------------------------------------------------------------------------------------------------------------------------------------------------------------------------------------------------------------------------------------------------------------------------------------------------------------------------------------------------------------------------------------------------------------------------------------------------------------------------------------------------------------------------------------------------------------------------------------------------------------------------------------------------------------------------------------------------------------------------------------------------------------------------------------------------------------------------------------------------------------------------------------------------------------------------------------------------------------------------------------------------------------------------------------------------------------------------------------------------------------------------------------------------------------------------------------------------------------------------------------------------------------------------------------------------------------------------------------------------------------------------------------------------------------------------------------------------------------------------------------------------------------------------------------------------------------------------------------------------------------------------------------------------------------------------------------------------------------------------------------------------------------------------------------------------------------------------------------------------------------------------| [LINEBREAK] | Photolithography Processes UV Optical Lithography Stocked Lithography Chemical + Datasheets Lists all stocked photolith. chemicals; PRs; strippers; developers; and links to the chemical''s application notes/datasheet; which detail the spin curves and nominal processes. Photo Lithography Recipe section Starting recipes (spin; bake; exposure; develop etc.) for all photolith. tools. Substrate/surface materials/pattern size can affect process parameters. Users may need to run Focus/Exposure Arrays/Matrix (FEA''s/FEM''s) with these processes to achieve high-resolution. Contact Aligner Recipes Suss MJB Aligners Suss MA6 Stepper Recipes Stepper #1: GCA 6300 (I-Line) Stepper #2: GCA Autostep 200 (I-Line) Stepper #3: ASML PAS 5500/300 (DUV) Direct-Write Recipes Heidelberg MLA150 JEOL JBX-6300FS EBL Raith Velion FIB Automated Coater Recipes (S-Cubed Flexi) General Photolithography Techniques Techniques for improving litho. or solving common photolith. problems. HMDS Process for Improving Adhesion Edge-Bead Removal Techniques Photoresist reflow (MicroChem) Lithography Calibration - Analyzing a Focus-Exposure Matrix Lift-Off Recipes Verified Recipes for lift-off using various photolith. tools General educational description of this technique and it''s limitations/considerations. E-beam Lithography E-Beam Lithography Recipes Has links to starting recipes. Substrates and patterns play a large role in process parameters. EBL Photoresist Datasheets Provided for reference; also showing starting recipes and usage info. Holography For 1-D and 2-D gratings with 220nm nominal period; available on substrates up to 1 inch square. Recipes for silicon substrates are provided; and have been translated to other substrates by users. Datasheets are provided with starting recipes and usage info. Edge-Bead Removal Edge photoresist removal methods needed for clamp-based etchers Improves resolution for contact lithography | [LINEBREAK] | Photolithography Chemicals/Materials Underlayers These are used beneath resists for both adhesive purposes and to enable bi-layer lift-off profiles for use with photoresist. Datasheets are provided. Anti-Reflection Coatings: The Photoresist Recipes section contains recipes using these materials. Bottom Anti-Reflection Coatings (BARC) are used in the stepper systems; underneath the resists to eliminate substrate reflections that can affect resolution and repeatability for small; near resolution limited; feature sizes. Datasheets are provided for reference on use of the materials. Contrast Enhancement Materials (CEM) The Photoresist Recipes section contains recipes using these materials. Used for resolution enhancement. Not for use in contact aligners; typically used on I-Line Steppers. Datasheets provided with usage info. Adhesion Promoters These are used to improve wetting of photoresists to your substrate. Datasheets are provided on use of these materials. Low-K Spin-on Dielectrics Spin-On Dielectrics Datasheets for BCB; Photo-BCB; and SOG (spin-on-glass) for reference on use. Low-K Spin-On Dielectric Recipes Recipes for usage of some spin-on dielectrics. Developers and Removers Datasheets provided for reference. Remover and Photoresist Strippers are used to dissolve PR during lift-off or after etching. |"
